[
  {
    "id": "land-raider-redeemer",
    "name": "Land Raider Redeemer",
    "faction_id": "grey-knights",
    "profiles": [
      {
        "name": "Land Raider Redeemer",
        "M": 12,
        "T": 12,
        "W": 16,
        "Sv": 2,
        "invuln_sv": null,
        "Ld": 6,
        "OC": 5
      }
    ],
    "points": [
      {
        "models": 1,
        "cost": 250,
        "unit_count_min": 1,
        "unit_count_max": 2
      },
      {
        "models": 1,
        "cost": 270,
        "unit_count_min": 3,
        "unit_count_max": null
      }
    ],
    "keywords": [
      "Frame",
      "Vehicle",
      "Transport",
      "Smoke",
      "Grenades",
      "Imperium",
      "Land Raider",
      "Redeemer"
    ],
    "faction_keywords": [
      "Grey Knights"
    ],
    "base_size_mm": {
      "shape": "hull",
      "draft": true
    },
    "model_count": {
      "min": 1,
      "max": 1
    },
    "weapon_ids": [
      "armoured-tracks",
      "flamestorm-cannon",
      "hunter-killer-missile",
      "multi-melta",
      "storm-bolter",
      "twin-assault-cannon"
    ],
    "ability_ids": [
      "assault-ramp",
      "deadly-demise-d6"
    ],
    "transport_capacity": {
      "capacity": 14
    },
    "game_version": {
      "edition": "11th",
      "dataslate": "launch"
    },
    "is_legend": false,
    "points_provisional": false
  },
  {
    "id": "grand-master-in-nemesis-dreadknight",
    "name": "Grand Master in Nemesis Dreadknight",
    "faction_id": "grey-knights",
    "role": "character",
    "profiles": [
      {
        "name": "Grand Master in Nemesis Dreadknight",
        "M": 8,
        "T": 8,
        "W": 13,
        "Sv": 2,
        "invuln_sv": 4,
        "Ld": 6,
        "OC": 4
      }
    ],
    "points": [
      {
        "models": 1,
        "cost": 200,
        "unit_count_min": 1,
        "unit_count_max": 2
      },
      {
        "models": 1,
        "cost": 215,
        "unit_count_min": 3,
        "unit_count_max": null
      }
    ],
    "keywords": [
      "Vehicle",
      "Character",
      "Walker",
      "Psyker",
      "Imperium",
      "Grand Master in Nemesis Dreadknight"
    ],
    "faction_keywords": [
      "Grey Knights"
    ],
    "base_size_mm": {
      "shape": "oval",
      "width": 120,
      "length": 92
    },
    "model_count": {
      "min": 1,
      "max": 1
    },
    "weapon_ids": [
      "dreadfists",
      "fragstorm-grenade-launcher",
      "gatling-psilencer",
      "heavy-incinerator",
      "heavy-psycannon",
      "nemesis-daemon-greathammer",
      "nemesis-flail",
      "nemesis-greatsword",
      "nemesis-mace",
      "sublimator"
    ],
    "ability_ids": [
      "deadly-demise-d3",
      "deep-strike",
      "surge-of-wrath-psychic",
      "warrior-strategist"
    ],
    "game_version": {
      "edition": "11th",
      "dataslate": "launch"
    },
    "is_legend": false,
    "points_provisional": false,
    "wargear_costs": [
      {
        "item_id": "heavy-psycannon",
        "cost": 15
      },
      {
        "item_id": "sublimator",
        "cost": 15
      }
    ]
  },
  {
    "id": "land-raider-crusader",
    "name": "Land Raider Crusader",
    "faction_id": "grey-knights",
    "profiles": [
      {
        "name": "Land Raider Crusader",
        "M": 12,
        "T": 12,
        "W": 16,
        "Sv": 2,
        "invuln_sv": null,
        "Ld": 6,
        "OC": 5
      }
    ],
    "points": [
      {
        "models": 1,
        "cost": 220,
        "unit_count_min": 1,
        "unit_count_max": 2
      },
      {
        "models": 1,
        "cost": 240,
        "unit_count_min": 3,
        "unit_count_max": null
      }
    ],
    "keywords": [
      "Frame",
      "Vehicle",
      "Transport",
      "Smoke",
      "Grenades",
      "Imperium",
      "Land Raider",
      "Crusader"
    ],
    "faction_keywords": [
      "Grey Knights"
    ],
    "base_size_mm": {
      "shape": "hull",
      "draft": true
    },
    "model_count": {
      "min": 1,
      "max": 1
    },
    "weapon_ids": [
      "armoured-tracks",
      "hunter-killer-missile",
      "hurricane-bolter",
      "multi-melta",
      "storm-bolter",
      "twin-assault-cannon"
    ],
    "ability_ids": [
      "assault-ramp",
      "deadly-demise-d6",
      "legacy-of-jerulas"
    ],
    "transport_capacity": {
      "capacity": 16
    },
    "game_version": {
      "edition": "11th",
      "dataslate": "launch"
    },
    "is_legend": false,
    "points_provisional": false
  },
  {
    "id": "grand-master",
    "name": "Grand Master",
    "faction_id": "grey-knights",
    "role": "character",
    "profiles": [
      {
        "name": "Grand Master",
        "M": 5,
        "T": 5,
        "W": 7,
        "Sv": 2,
        "invuln_sv": 4,
        "Ld": 6,
        "OC": 1
      }
    ],
    "points": [
      {
        "models": 1,
        "cost": 95
      }
    ],
    "keywords": [
      "Infantry",
      "Character",
      "Psyker",
      "Grenades",
      "Terminator",
      "Imperium",
      "Grand Master"
    ],
    "faction_keywords": [
      "Grey Knights"
    ],
    "base_size_mm": {
      "shape": "round",
      "diameter": 40
    },
    "model_count": {
      "min": 1,
      "max": 1
    },
    "weapon_ids": [
      "incinerator",
      "nemesis-force-weapon",
      "psilencer",
      "psycannon",
      "storm-bolter-grand-master"
    ],
    "ability_ids": [
      "leader",
      "might-of-titan-psychic",
      "deep-strike"
    ],
    "game_version": {
      "edition": "11th",
      "dataslate": "launch"
    },
    "is_legend": false,
    "points_provisional": false,
    "attachment_role": "leader"
  },
  {
    "id": "razorback",
    "name": "Razorback",
    "faction_id": "grey-knights",
    "role": "dedicated-transport",
    "profiles": [
      {
        "name": "Razorback",
        "M": 12,
        "T": 9,
        "W": 10,
        "Sv": 3,
        "invuln_sv": null,
        "Ld": 6,
        "OC": 2
      }
    ],
    "points": [
      {
        "models": 1,
        "cost": 85
      }
    ],
    "keywords": [
      "Frame",
      "Vehicle",
      "Transport",
      "Dedicated Transport",
      "Smoke",
      "Imperium",
      "Razorback"
    ],
    "faction_keywords": [
      "Grey Knights"
    ],
    "base_size_mm": {
      "shape": "hull",
      "draft": true
    },
    "model_count": {
      "min": 1,
      "max": 1
    },
    "weapon_ids": [
      "armoured-tracks-razorback",
      "hunter-killer-missile",
      "storm-bolter",
      "twin-heavy-bolter",
      "twin-lascannon"
    ],
    "ability_ids": [
      "fire-focus",
      "fire-support",
      "deadly-demise-d3"
    ],
    "transport_capacity": {
      "capacity": 6
    },
    "game_version": {
      "edition": "11th",
      "dataslate": "launch"
    },
    "is_legend": false,
    "points_provisional": false
  },
  {
    "id": "purifier-squad",
    "name": "Purifier Squad",
    "faction_id": "grey-knights",
    "profiles": [
      {
        "name": "Purifier",
        "M": 6,
        "T": 4,
        "W": 2,
        "Sv": 2,
        "invuln_sv": null,
        "Ld": 6,
        "OC": 1
      }
    ],
    "points": [
      {
        "models": 5,
        "cost": 130,
        "unit_count_min": 1,
        "unit_count_max": 2
      },
      {
        "models": 6,
        "models_max": 10,
        "cost": 260,
        "unit_count_min": 1,
        "unit_count_max": 2
      },
      {
        "models": 5,
        "cost": 140,
        "unit_count_min": 3,
        "unit_count_max": null
      },
      {
        "models": 6,
        "models_max": 10,
        "cost": 270,
        "unit_count_min": 3,
        "unit_count_max": null
      }
    ],
    "keywords": [
      "Infantry",
      "Psyker",
      "Grenades",
      "Imperium",
      "Purifier Squad"
    ],
    "faction_keywords": [
      "Grey Knights"
    ],
    "base_size_mm": {
      "shape": "round",
      "diameter": 32
    },
    "model_count": {
      "min": 5,
      "max": 10
    },
    "weapon_ids": [
      "close-combat-weapon",
      "incinerator",
      "nemesis-force-weapon-purifier-squad",
      "psilencer-purifier-squad",
      "psycannon-purifier-squad",
      "purifying-flame",
      "storm-bolter"
    ],
    "ability_ids": [
      "sanctity-of-purpose",
      "deep-strike"
    ],
    "game_version": {
      "edition": "11th",
      "dataslate": "launch"
    },
    "is_legend": false,
    "points_provisional": false,
    "wargear_budgets": [
      {
        "items": [
          "close-combat-weapon",
          "incinerator",
          "psilencer-purifier-squad",
          "psycannon-purifier-squad"
        ],
        "count": 4,
        "per_models": 10
      }
    ],
    "wargear_costs": [
      {
        "item_id": "psycannon",
        "cost": 5
      }
    ]
  },
  {
    "id": "nemesis-dreadknight",
    "name": "Nemesis Dreadknight",
    "faction_id": "grey-knights",
    "profiles": [
      {
        "name": "Nemesis Dreadknight",
        "M": 8,
        "T": 8,
        "W": 13,
        "Sv": 2,
        "invuln_sv": 4,
        "Ld": 6,
        "OC": 4
      }
    ],
    "points": [
      {
        "models": 1,
        "cost": 195,
        "unit_count_min": 1,
        "unit_count_max": 2
      },
      {
        "models": 1,
        "cost": 210,
        "unit_count_min": 3,
        "unit_count_max": null
      }
    ],
    "keywords": [
      "Vehicle",
      "Walker",
      "Psyker",
      "Imperium",
      "Nemesis Dreadknight"
    ],
    "faction_keywords": [
      "Grey Knights"
    ],
    "base_size_mm": {
      "shape": "oval",
      "width": 120,
      "length": 92
    },
    "model_count": {
      "min": 1,
      "max": 1
    },
    "weapon_ids": [
      "dreadfists",
      "gatling-psilencer",
      "heavy-incinerator",
      "heavy-psycannon",
      "nemesis-daemon-greathammer",
      "nemesis-greatsword"
    ],
    "ability_ids": [
      "indomitable-spirit-psychic",
      "deep-strike",